Citigroup's (C +2.7%) $7.8B in buybacks was 10% higher than estimated by MKM analyst David Trone. Combined with the nickel dividend, that's total shareholder returns of $8.4B vs. his $7B expectation.
Bank of America (BAC -1%) - though given just conditional approval - is set for $4B in buybacks and a nickel dividend. That's a total return of $6.1B vs. Trone's $3.1B estimate. Trone notes the bank can proceed with its buyback prior to resubmitting plans.
JPMorgan's (JPM +1%) $6.4B buyback was shy of Trone's $7B estimate, but the 10% dividend increase was better than forecast. The total capital return of $12.9B vs. his $13.2B forecast is a "marginal negative."
The dividend hike to $0.65 at Goldman (GS +2.1%) beat Trone's expectation of $0.62. As for the buyback, Goldman's policy of not disclosing the amount remains in place.
Morgan Stanley's (MS +4.5%) capital return of $4.3B is more than double Trone's $1.9B estimate.
Source: Benzinga

|Mar. 12, 2015, 8:07 AM|Deutsche: Citigroup and Regions are CCAR's big winners; BofA result not so bad


Citi's (NYSE:C) quarterly dividend of $0.05 and $7.8B in buybacks were somewhat better than expected, and Regions Financial's (NYSE:RF) buybacks of $875M was higher than the $625M estimate (Regions also boosted its dividend by 20%).
KeyCorp (NYSE:KEY), Morgan Stanley (NYSE:MS), and SunTrust (NYSE:STI) were also winners after announcing larger-than-forecast buybacks.
Bank of America (NYSE:BAC) is a "slight disappointment," but some investors had feared an outright rejection of the capital plan, so maybe the resubmission request isn't the worst outcome.
Previously: Corbat likely keeping his job as Citi cruises through CCAR (March 11)
Previously: Regions Financial boosts payout by 20% after CCAR approval (March 11)
Previously: KeyCorp declares $0.075 dividend (March 11)
Previously: Morgan Stanley intends to declare $0.15 dividend (March 11)
Previously: SunTrust Banks declares $0.24 dividend (March 11)
C +3.4%, RF +3.8%, KEY +1.7%, MS +2.7%, STI +2.1%, BAC +0.6% premarket
|Mar. 11, 2015, 5:14 PM|CCAR winner Citigroup quintupling dividend to a nickel per share


Passing the CCAR by the widest margin of all the TBTF banks, Citigroup (NYSE:C) lifts its quarterly dividend to $0.05 per share from $0.01, and sets a buyback program of up to $7.8B through the end of 2016 Q2. The new annualized dividend yield is 0.38%.
Shares +3.3% after hours
Previously: Corbat likely keeping his job as Citi cruises through CCAR (March 11)
|Mar. 11, 2015, 4:57 PM|Corbat likely keeping his job as Citi cruises through CCAR


Citigroup (NYSE:C) CEO Michael Corbat staked his job on passing this year's CCAR after last year's foul-up, and he looks to have earned his seat for at least another year.
CThe bank's Tier 1 common ratio fell to 7.1% under the worst-case scenario, a cleaner pass than any of its TBTF peers. Goldman, Morgan Stanley, and JPMorgan had to resubmit capital plans after coming too close to the 5% minimum, and Bank of America came in at 6.8%, but was not approved (yet) because of qualitative reasons.
The details of Citi's repurchase and dividend plans have not yet been released by the bank.
Shares +1.4% after hours.
CCAR results
Previously: More CCAR: Goldman, Morgan Stanley, and JPMorgan pass after resubmissions (March 11)
Previously: BofA must resubmit capital plan; Deutsche and Santander rejected (March 11)
|Mar. 11, 2015, 12:47 PM|Banco Popular reportedly drops interest in Citi Central American units

CItigroup (C +2.7%) was seeking $1.5B for its Central American -  Costa Rica, El Salvador, Guatemala, Nicaragua, Panama - retail units, and Bloomberg last week reported a deal with Spain's Banco Popular was close.Now Bloomberg says Banco Popular has dropped out of talks as the purchase wouldn't fit with its strategy going forward. Maybe next in line to buy is Grupo Aval Acciones y Valores, the Colombian banking group controlled by Luis Carlos Sarmiento Angulo.Citi's interest in selling is in keeping with plans to simplify its business, and the bank last October announced its intention to exit consumer banking in 11 countries - these Central American ones being part of that 11.|Mar. 11, 2015, 9:11 AM|What Dodd-Frank? Citigroup roars back


Citigroup (NYSE:C) with good reason is being quiet about it - its executives preferring to talk about streamlining and asset sales - but its traders and investment bankers are roaring back at a time when many of the bank's peers are scaling down, writes Peter Eavis in the NYT.
The comeback has involved scooping up massive amounts of derivatives, and assets at the unit encompassing the investment bank footed to $1.06T at the end of 2014 - up 6% from 2010 vs. a 6% decline in similar assets at Goldman Sachs, and a 4% decline at JPMorgan.
The unit is also raking in profits - the investment bank earned $200M more than the consumer bank in 2012, but $2.5B more in each of the last two years.
A little lobbying helps. The bank's people in D.C. helped draft a recent law gutting a provision of Dodd-Frank aimed at pulling taxpayer support from certain types of derivatives.
CCAR results are due after the closing bell today.
|Mar. 9, 2015, 3:44 AM|Lenders face Fed stress test round two


Despite all thirty-one global banks passing the first round of the Fed's stress test last Thursday, a tougher second round test this week, known as the Comprehensive Capital Analysis and Review (CCAR), will either approve or disapprove the lenders' capital return plans.
Last year, Citigroup (NYSE:C) became the only big U.S. bank to have its plans thrown out, with the Fed citing "insufficient" improvement in areas previously flagged. Other 2014 CCAR losers: Citizens (NYSE:RBS), HSBC (NYSE:HSBC) and Santander (NYSE:SAN).
Previously: All 31 lenders pass the stress test (Mar. 05 2015)
|Mar. 6, 2015, 9:32 AM|Post-stress test upgrade for Citigroup


"Citigroup (NYSE:C) has a clearer path to improved [capital] returns and the company should no longer trade at a discount to tangible book value," says KBW, upgrading to Outperform from Market Perform and lifting the price target to $61 from $54 following last night's stress test results.
Shares +0.5% in early action.
KBW's Citi upgrade comes as it cuts State Street - which also passed the stress test, but the result wasn't as strong as last year.
Previously: All pass the stress test, but some cut it close (March 5)
Previously: Stress test roundup: How the lenders stack up vs. last year (March 5)
|Mar. 5, 2015, 8:28 PM|Stress test roundup: How the lenders stack up vs. last year


The minimum Tier 1 common capital ratio for banks is 5%, according to the Fed, and here's how the 31 lenders stacked up under the central bank's severely adverse scenario vs. a year ago (h/t: WSJ):
Deutshce Bank (NYSE:DB): 34.7%, not tested a year ago
DIscover (NYSE:DFS): 13.9% vs. 13.2% a year ago
Bank of New York Mellon (NYSE:BK): 12.6% vs. 13.1%
American Express (NYSE:AXP): 12.5% vs. 12.1%
Northern Trust (NASDAQ:NTRS): 12.3% vs. 11.7%
State Street (NYSE:STT): 11.8% vs. 13.3%
Citizens Financial (NYSE:CFG): 10.7% vs. 10.7%
KeyCorp (NYSE:KEY): 9.9% vs. 9.2%
Capital One (NYSE:COF): 9.5% vs. 7.8%
PNC Financial (NYSE:PNC): 9.5% vs. 9%
Santander Holdings USA (SAN's U.S. unit): 9.4% vs. 7.3%; shares +0.8% after hours
BMO Financial (BMO's U.S. unit): 9% vs. 7.6%
Comerica (NYSE:CMA): 9% vs. 8.6%
Huntington Bancshares (NASDAQ:HBAN): 9% vs. 7.4%
HSBC North America (NYSE:HSBC): 8.9% vs. 6.6%
U.S. Bancorp (NYSE:USB): 8.5% vs. 8.2%
Regions Financial (NYSE:RF): 8.3% vs. 8.9%
Citigroup (NYSE:C): 8.2% vs. 7.2%
SunTrust (NYSE:STI): 8.2% vs. 8.8%
BB&T (NYSE:BBT): 8.1% vs. 8.4%
MUFG Americas Holdings (NYSE:MTU): 8% vs. 8.1%
Ally Financial (NYSE:ALLY): 7.9% vs. 6.3%
Fifth Third Bancorp (NASDAQ:FITB): 7.9% vs. 8.4%
Wells Fargo (NYSE:WFC): 7.5% vs. 8.2%
M&T Bank (NYSE:MTB): 7.3% vs. 6.2%
Bank of America (NYSE:BAC): 7.1% vs. 5.9%; shares +2.1% after hours
JPMorgan (NYSE:JPM): 6.5% vs. 6.3%
BBVA Compass (NYSE:BBVA): 6.3% vs. 8.5%
Goldman Sachs (NYSE:GS): 6.3% vs. 6.9%
Morgan Stanley (NYSE:MS): 6.2% vs. 6.1%
Zions Bancorp (NASDAQ:ZION): 5.1% vs. 3.6%; shares -1.7% after hours
The lenders were also informed today whether their capital return plans would put them below the Fed's 5% threshold, giving them a 6-day window with which to change those requests, if need be. Last year, both BofA and Goldman scaled back their dividend/buyback requests, allowing them to pass the CCAR. This year's CCAR results will be announced on Wednesday.
2015 Stress Test Methodology and Results
|Mar. 5, 2015, 5:24 PM|All pass the stress test, but some cut it close


2015 stands as the first year since the stress tests started in 2009 that all banks maintained necessary capital levels under the severe adverse scenario, though Zions Bancorp (NASDAQ:ZION) just squeaked by with a Tier 1 capital ratio of 5.1% vs. the 5% minimum. Citigroup's (NYSE:C) ratio of 8.2% easily passed.
Another measure more relevant to those banks active in capital markets is total risk-based capital, and Goldman Sachs(NYSE:GS) at 8.1% and Morgan Stanley (NYSE:MS) at 8.6% were just north of the minimum 8% required.
In aggregate, the 31 banks subject to the test showed capital ratios falling to 8.2% under the severe adverse scenario vs. 5.5% in 2009, and against the 5% minimum allowed.
Previously: All 31 lenders pass the stress test (March 5)
Stress Test 2015 Methodology and Results
ZION -0.6%, GS -0.7%, MS -0.9%, C -0.55% after hours.
|Mar. 5, 2015, 7:36 AM|Citigroup exits Akbank investment at a loss


Citigroup (C -0.1%) purchased a 20% stake in Turkey's 2nd largest bank (by market value) in 2007 for $3.1B, and today sold its remaining 9.9% holding for $1.15. Combined with a previous sale of a near equivalent amount, Citi lost $800M on the investment.
At this point for Citi, exiting non-core investments is of more import than wringing every last dollar out of them, nevertheless, some analysts say Citi's willingness to take a big loss on the Turkish lender signals more trouble for that stock market (NYSEARCA:TUR) - the globe's 2nd worst-performer in February.
While Citi has exited the retail banking business in Turkey, it will continue to serve corporate and commercial clients.
TUR -2.1% premarket, led by a 5.4% decline in Akbank.
|Mar. 4, 2015, 1:16 PM|Citi's own Winston Wolf guides bank through must-pass stress test


Not long after Citigroup (C) CEO Michael Corbat sent out invitations last spring for the retirement party for former head of Citibank, Gene McQuade, he was asking McQaude to take the most important job at the bank - making sure it passes this year's stress test and CCAR.
McQuade grew up in NYC housing projects, reports Christina Rexrode in the WSJ, put himself through college driving a taxi, and - well-liked by both regulators and bankers - has earned a reputation as a go-to person for managing a crisis.
“He’s absolutely the person you want in a conflict situation where the stakes are high. Smart, ethical, keeps his cool,” says Dick Kearns, who served with McQuade as a trustee at St. Bonaventure during a 2003 recruiting controversy. "If he were an airline pilot, he'd be Sully Sullenberger."
Under McQuade, Citi this year has renovated risk models, hired more compliance staff, and attempted to address a Fed complaint that risk  procedures are too centralized at HQ.
"We really need to turn this into an A-plus paper," McQuade tells his colleagues.
Stress test results are due after the close on Thursday, with the CCAR results six days later.
|Mar. 3, 2015, 2:57 PM|Some losses, but overall benefit to Citi from OneMain sale


Nice job in getting rid of your most profitable business, Citigroup (C +0.4%), writes Anthony Currie of the sale of OneMain Financial to Springleaf for $4.25B. The unit's ROA of 6.7% is about seven times better than the Citi as a whole, and while earnings of nearly $600M this year are only a fraction of the many billions the entire bank might earn, Citi could use all it can get.
Citi boss Michael Corbat, however, has plenty with which he can offset that hit, says Currie, noting a pretax gain of about $1B on the sale along with the opportunity to tap into the bank's roughly $50B DTA. There's also the freeing up of capital from the removal of OneMain's nearly $10B in assets. Assuming Citi holds 10% of that, Corbat can either reinvest $1B or ask the Fed to allow it to be returned to shareholders.
Previously: Springleaf sees big things with OneMain purchase (March 3)
Previously: Springleaf (finally) lands Citi's OneMain Financial (March 3)
|Mar. 3, 2015, 11:23 AM|JPMorgan: Citi's Costco agreement is a big deal


The Costco co-branding deal adds a third leg to the Citigroup (C +0.6%) story, says analyst Vivek Juneja, upgrading the stock to Overweight with price target boosted to $58 from $54.
One of his concerns with Citi, says Juneja, has been tepid growth and loss of market share in key businesses like U.S. credit cards, and the Costco deal should reverse this worry. The bank, he assumes, was likely able to win a very competitive bidding process because of its ability to utilize its DTAs.
He's not boosting his EPS estimates just yet because Citi has not announced an agreement for Costco's $14B in estimated receivables held by AmEx, but he expects one should follow a la the Best Buy deal in 2013.
Turning to the stress test and CCAR, Juneja expects Citigroup to be approved for capital returns this year. He also expects the bank to hit its operating efficiency targets in 2015.
Previously: Springleaf (finally) lands Citi's OneMain Financial (March 3)
Previously: Citigroup and Visa take AmEx's spot with Costco (March 2)
|Mar. 3, 2015, 7:15 AM|Springleaf (finally) lands Citi's OneMain Financial


In a deal that's been talked about since Sandy Weill ran Citigroup (NYSE:C), Springleaf Financial (NYSE:LEAF) has agreed to purchase Citi's OneMain Financial for $4.25B in cash. The transaction is expected to close in Q3.
Citi's consumer finance unit, OneMain has been reported under the Citi Holdings unit, of which the bank has feverishly trying to work its way down to as close to zero dollars in assets as possible. In a presentation yesterday, the bank noted assets at Citi Holdings have fallen to just 5% of total bank assets from 32% in 2008.
Citi will use the sale proceeds to pay down Citi Holdings debt, and the bank expects to see earnings boosted by about $1B thanks to the deal.
For Fortress Investment (NYSE:FIG)-backed Springleaf (Fortress purchased LEAF from AIG in 2010), it gets a natural fit in a complimentary consumer finance business
C +1% premarket. LEAF no action.
See also: Springleaf see big things with OneMain purchase (March 3)
|Mar. 2, 2015, 1:05 PM|Citi tips lower markets revenue in Q1


Presenting at the Raymond James conference, Citigroup (C +1.6%) CFO John Gerspach expects Q1 FICC revenue down in the mid-to-high single digits from a year earlier thanks to a slow start in spread products and a hit (reported at $150M) from the SNB's shock franc revaluation in January.

Webcast and presentation slides.
The presentation of Citi's transformation since the crisis is pretty interesting. The bank had $1.9T of assets balanced on just $23B of CET1 capital in 2008, and now has $1.8T of assets on a full $137B of CET1 capital. Citi Holdings assets of $619B or 32% of total assets in 2008 have been cut to $98B and just 5% of the total.
As for headcount, it's been cut to 323K from 241K, but it's a bull market for regulatory and compliance staff, where headcount has been boosted to 26K from 14K.
Previously: Citigroup and Visa take AmEx's spot with Costco (March 2)
|Mar. 2, 2015, 8:13 AM|Citigroup and Visa take AmEx's spot with Costco


Citigroup (NYSE:C) will become the exclusive co-issuer of Costco's (NASDAQ:COST) co-brand credit cards, and Visa (NYSE:V) will replace American Express (NYSE:AXP) as the credit card network for Costco in the U.S. and Puerto Rico, beginning April 1, 2016.
On CNBC as the news hit, AmEx shareholder Warren Buffett: Citi won't get rich off the Costco deal.
C +0.6%, V +2.4% premarket
|Mar. 2, 2015, 2:34 AM|Citigroup awaits 'stress test' results


Citigroup (NYSE:C) executives are facing a critical hurdle this month, as they prepare for the institution's "stress test" results, FT reports quoting senior figures at the bank.
A year ago Citi became one of a handful of banks to have its capital plan rejected by the Fed, on the grounds that it had inadequate processes in place for assessing its capital needs in the event of a severe recession.
If the bank were to fail again, CEO Mike Corbat, CFO John Gerspach and Brian Leach, head of risk, would be under strong pressure from investors to step down.
|Feb. 23, 2015, 12:59 PM|Might Citigroup make a play for Costco business?


Expecting Citigroup (C -1.5%) to "bid aggressively" for a co-branding deal with Costco (now that AmEx is out of the way), JPMorgan's Vivek Juneja says it would 1) add to overall Citi ROA; 2) offer revenue growth and co-branding portfolio diversification; 3) utilization of Citi's DTA. Weighing against a deal? Low margins in co-branding thanks to intense competition.
Previously: With AmEx out as Costco, who's in? (Feb. 12)
|Feb. 23, 2015, 12:07 PM|Consumer discretionary and tech popular as iBillionaire rebalances

Among the additions to the index (which fuels the IBLN ETF) are EMC, Google (GOOG, GOOGL), Goodyear (NASDAQ:GT), Mohawk Industries (NYSE:MHK), PVH, Time Warner (NYSE:TWX), and Yahoo (NASDAQ:YHOO). There are three health care additions as well: Allergan (NYSE:AGN), Amgen (NASDAQ:AMGN), and HCA. The lone energy name added is Consol Energy (NYSE:CNX).Exiting the index are energy names Halliburton (NYSE:HAL) and National-Oilwell Varco (NYSE:NOV), along with healthcare companies AbbVie (NYSE:ABBV), Aetna (NYSE:AET), Humana (NYSE:HUM), and Tenet Healthcare (NYSE:THC). Citigroup (NYSE:C), CBS, Crown Castle (NYSE:CCI), and Michael Kors (NYSE:KORS) round out those subtracted.IBLN tracks the highest-conviction S&P 500 picks by hot-handed billionaires who built their fortunes through hedge funds and investing. The list of billionaires tracked is updated each October, and the equity components are rebalanced each quarter after sifting through regulatory filings.IBillionaire Index Rebalance|Feb. 20, 2015, 2:32 PM|Reuters: Springleaf nearing $4B deal for Citi's OneMain


The price sounds right as the $4B level has been thrown around as a possible sales amount for months, with Springleaf Holdings (LEAF +7.5%) at the top of the list of possible bidders.
OneMain Financial is Citigroup's (C +1.2%) consumer/subprime lending business, and Springleaf's natural fit perhaps allowed it to pay more than P-E firms who might otherwise have been buyers.
Previously: OneMain sale could create a windfall for Citi owners (Jan. 21)
|Feb. 20, 2015, 9:20 AM|Corbat gets small pay cut after tough 2014


Citigroup (NYSE:C) CEO Mike Corbat's total pay for 2014 of $13.2M was 9% lower than the previous year. This year's compensation includes deferred stock valued at $3.51B, the same amount in performance-share units, a cash bonus of $4.68M, and a salary of $1.5M.
The scorecard: Citigroup's stock was the worst performer among the six largest U.S. banks in 2014, gaining 3.8%, the lender disclosed a $400M loan fraud at its Mexican unit, and the bank failed to win Fed approval for boosted capital returns.
Corbat has pretty much staked his job on passing the CCAR this year.
SEC Form 8-K
|Feb. 20, 2015, 9:02 AM|Citigroup consumer banking chief out


It's been rumored for a few months that Citigroup's (NYSE:C) consumer banking head Manuel Medina-Mora was exiting, but now there's a date on it - June 1. His days were numbered after the blowup at Citi's Mexican unit Banamex, where he's chairman.
The bank will name a replacement in the "near future," says CEO Michael Corbat in a letter to employees.
Previously: Citigroup cleans house at Banamex (Oct. 27, 2014)
|Feb. 20, 2015, 4:48 AM|Wall Street sees head count drop

Squeezed by new capital and risk rules and tough markets, Wall Street is taking the ax to its workforce, a report by London research firm Coalition shows.The number of investment bankers, traders, salespeople and research analysts at the world’s largest banks has fallen 20% globally since its recent peak in 2010.While job cuts on the front end have become standard, firms have been increasing their back-office hiring to beef up controls in areas ranging from compliance to risk.Related tickers: BAC, BCS, OTCQX:BNPQY, C, CS, DB, GS, JPM, MS, UBS|Feb. 20, 2015, 3:10 AM|Santander, N.Y. reach accord over bank account access


Santander (NYSE:SAN) has agreed to switch the way it screens applicants for checking and savings accounts, joining Citi (NYSE:C) and Capital One (NYSE:COF) which have already reached such a pact with New York Attorney General Eric Schneiderman.
The accord comes amid concerns that the current screening process (through consumer-reporting agency ChexSystems) makes it harder for lower-income customers to open accounts, forcing them to rely on high-cost alternatives like check-cashing outlets.
Schneiderman also has been looking into JPMorgan (NYSE:JPM) over its use of customer-screening databases, sources told Reuters.
Previously: Citibank settles with NY over checking account screenings (Jan. 28 2015)
|Feb. 18, 2015, 2:49 PM|Financials stumble after dovish FOMC minutes


The financial sector had begun to turn around a dismal start to the year as February brought forth a string of hawkish Fed heads suggesting a June rate hike, but the XLF is lower by 0.8% after just-released FOMC minutes suggest markets and the hawks are getting ahead of themselves. KBE -1.7%, KRE -2%

The TBTFs: BofA (BAC -2.2%), JPMorgan (JPM -1.4%), Wells Fargo (WFC -1.6%), Ciitgroup (C -0.8%)
The regionals: Regions Financial (RF -1.6%), KeyCorp (KEY -1.6%), PNC Financial (PNC -1.3%), BB&T (BBT -1.5%), Fifth Third (FITB -1.6%), SunTrust (STI -1.7%), First Niagara (FNFG -2.1%), M&T (MTB -1.9%), U.S. Bancorp (USB -1.3%), First Horizon (FHN -2.7%).
Online brokerage: Schwab (SCHW -2.3%), E*Trade (ETFC -1.7%), Ameritrade (AMTD -1.1%), Interactive Brokers (IBKR -0.9%).
Previously: FOMC minutes: June rate hike not a slam dunk yet (Feb. 18)
ETFs: XLF, FAS, FAZ, UYG, KRE, VFH, KBE, IYF, IAT, IAI, SEF, IYG, FXO, FNCL, KBWB, QABA, FINU, KCE, KRU, RWW, KBWR, RYF, KBWC, FINZ, KRS

|Feb. 18, 2015, 11:41 AM|Tepper slashed U.S. stock holdings in 2014


Appaloosa Fund's equity holdings stood at $4.049B as of year-end, down from $9.058B at the end of Q1 2014, according to Whalewisdom.com. Among the stakes cut back in Q4 were those in Citibank (C -0.4%), Halliburton (HAL -0.3%), Facebook (FB +1.2%), and CBS Corp. (CBS -0.3%).
The big drop doesn't necessarily mean Tepper's turning bearish on U.S. stocks, but instead it was reported late last year of his intention to return up to $4B in capital to investors in an effort to maintain an optimum size for the fund.
13F
Previously: David Tepper returning billions to investors after tough year (Nov. 25, 2014)
|Feb. 17, 2015, 8:35 AM|Peter Henry appointed to Citigroup board

The dean of NYU's Stern School of Business, Henry is an emerging markets economist and the author of "Turnaround: Third World Lessons for First World Growth."He'll join the Citi (NYSE:C) board in July, bringing the total number of members to 14.|Feb. 13, 2015, 7:22 PM|Loeb adds Citigroup, Alibaba, AIG stakes; drops FedEX

 Dan Loeb added new stakes in Citigroup (NYSE:C), Alibaba (NYSE:BABA), AIG, EMC and Allergan (NYSE:AGN) in the fourth quarter as the latest 13F from his Third Point fund indicates. The Alibaba addition of 2.8M shares to an existing 7.2M-share position brings Third Point to 10M shares. A new Citigroup position is 25M shares. Meanwhile, a 400K-share stake in Allergan is a new position, as is 7M shares in EMC and 3.5M shares of AIG. Loeb also unloaded a 750K-share position in FedEx (NYSE:FDX).Overall Third Point increased the value of equity holdings 27%, to $11.09B. After hours: BABA -0.5%; AGN +0.5%. |Feb. 12, 2015, 1:11 PM|Citi boosting forex trading fees as much as 25%


Claiming heightened volatility that has made the currency markets more dangerous - meaning more technology and client-coverage costs - Citigroup (C +2.1%) is hiking prices for clearing and settling forex trades for some prime brokerage clientele by up to 25%, reports Bloomberg.
The bank notably lost more than $150M when the Swiss abandoned their euro floor last month, and also recently paid over $1B to make forex manipulation probes go away.
Citi likely has some market power in prime brokerage as many have scaled back in recent years, with the shakeout leaving the bank, along with Deutsche Bank and JPMorgan, as the big winners.
|Feb. 10, 2015, 11:51 AM|Deutsche Citi upgrade: $4B in buybacks coming



Among the upside catalysts for Citigroup (C +0.4%) - says Deutshce in its upgrade of the stock to Buy from Hold - will be the approval of $4B in share repurchases in this spring's CCAR.
Citi's plans to buy back stock and boost the dividend have been rejected by the Fed twice in the last three years, and CEO Michael Corbat has staked his job on approval this year.
Another catalyst, says Deutsche, will be the sale or IPO of OneMain Financial.
Turning back to the CCAR, Detusche expects the largest increases in capital returns to be at Citi, Bank of America (BAC +0.6%), Regions Financial (RF +0.3%), Morgan Stanley (MS +1.1%), SunTrust (STI +0.1%), and Citizens Financial (CFG +1.9%). Total payout ratios at the larger regional lenders should be 79% this year, up 1000 basis points from 2014.
Previously: Bank pair trade from Deutsche (Feb. 10)
Presenting at the Credit Suisse conference, CEO of U.S. Consumer & Commerical Banking and Citi Mortgage Jane Fraser touts the banks laser focus for retail on this country's largest 7 markets.
Presentation slides
