Date|Headline|Today, 4:42 AM|U.S. investment banks lead Europe

The top five places in the global investment banking league table now firmly belong to U.S. banks, according to industry analytics firm Coalition, reflecting their domination over struggling European peers.The gap has widened consistently since 2011, when the U.S.-European split was roughly 50-50.American banks now take in around a two-thirds share of the investment banking revenue pie.Tickers by scores: JPM, C, GS, BAC, MS, DB, BCS, CS, HSBC|Yesterday, 12:09 PM|Bank bulls bail; BofA -4.5% leads decline: Kass says "short"

"Group stink has never been more conspicuous than in financial sector stocks," says Doug Kass, calling the top in the piping hot names.A strong economy, eased regulation, and higher interest rates have all been fully baked into valuations, says Kass, but being ignored: signs of a slowing economy, peaking auto sales, growing protectionism, and valuations at pre-crisis levels.Then there's the housing market, and it's "reached an inflection point in price and activity," says Kass. He notes prices of higher-end West and East coast homes have turned lower - usually a bell-ringer for the residential housing cycle.Favored shorts: MetLife (MET -1.1%), Lincoln Financial (LNC -2.9%), Goldman Sachs (GS -2%), Morgan Stanley (MS -2.7%). Others he's eyeing: Bank of America (BAC -4.4%), Citigroup (C -0.8%), JPMorgan (JPM -1.3%).One name he's a fan of is Hartford Financial (HIG -0.5%).|Mon, Mar. 20, 1:52 PM|Financials continue to struggle post-rate hike

The major averages are off just a fraction today, but the KRE and KBE are down 1%, and the broader financial sector (NYSEARCA:XLF), 0.5%.In a bit of buy the rumor/sell the news action, interest rates - and with them financials/banks - topped out just ahead of the Fed rate hike last Wednesday.The 10-year Treasury yield - above 2.60% ahead of the Fed move - is down another three basis points today to 2.47%.BofA (BAC -1.3%), Morgan Stanley (MS -1.1%), Citigroup (C -0.8%), KeyCorp (KEY -0.4%), BB&T (BBT -0.6%), U.S. Bancorp (USB -0.1%), MetLife (MET -0.2%), Prudential (PRU -0.4%), Schwab (SCHW -0.9%)|Wed, Mar. 15, 2:33 PM|Banks head lower following rate hike

The major averages, bonds, and gold have all turned higher after the Fed lifted the Fed Funds rate by 25 basis points, but satiated bank bulls might be lightening up just a hair.After all, the "dots" showed the Fed as being no more hawkish than a couple of meetings back when it surprised the world by predicting three rate hikes this year. Inflation and growth expectations were essentially unchanged as well.So while the Fed may have been faster with a rate hike than many expected just a couple of weeks back, it appears the timetable past today remains the same.KBE -0.15%, KRE -0.1%, XLF flatJanet Yellen's press conference is just getting underway.Bank of America (BAC -0.2%), Citigroup (C -0.6%), JPMorgan (JPM +0.3%), Wells Fargo (WFC +0.1%), Goldman Sachs (GS +0.1%), U.S. Bancorp (USB +0.3%), PNC Financial (PNC -0.4%), KeyCorp (KEY +0.2%), Regions Financial (RF), SunTrust (STI -1%), Fifth Third (FITB -0.7%)ETFs: XLF, FAS, FAZ, UYG, VFH, IYF, BTO, IYG, FNCL, SEF, FXO, RYF, FINU, RWW, XLFS, FINZ, JHMF, FAZZ, FNCF|Thu, Mar. 9, 12:19 PM|Bureaucracy 1, Dodd-Frank reformers 0

For now, Washington D.C. is winning the battle against those in favor of quickly rolling back swaths of Dodd-Frank. For now, the Senate Banking Committee and House Financial Services Committee are working on other things, while Republicans instead spend political capital on things like Obamacare repeal and tax reform.Barney Frank is taking a victory lap, telling Bloomberg nothing substantial will get through Congress. He does expect the possibility of relief for smaller banks, but the likes of JPMorgan (NYSE:JPM), Citigroup (NYSE:C), Goldman Sachs (NYSE:GS), Bank of America (NYSE:BAC), Wells Fargo (NYSE:WFC), Morgan Stanley (NYSE:MS) and others probably shouldn't be holding their breath for big changes.KBW's Brian Gardner: “Changes to the Dodd-Frank Act are second-tier agenda items and are unlikely to pass Congress in the near term ... Improvement in the regulatory regime is likely to be subtle and not seen by the public."|Wed, Mar. 8, 9:15 AM|Another big day for financials on tap after ADP number

The ADP reported a whopping 298K jobs added in February, the third-best print of the recovery.Fixed-income players have responded by sending the yield on the 10-year Treasury up 5.5 basis points to 2.573, and the odds of a rate hike next week to 100%.Yield-starved financials continue to get less so by the day. Premarket: XLF +1.2%, KRE +1.2%, BAC +1.9%, WFC +1.2%, JPM +1.3%, C +1.6%|Thu, Mar. 2, 6:54 AM|Invesco Equity and Income Fund A (ACEIX) February Summary

February monthly performance was: +2.45%AUM of $14.2B52-week performance vs. the S&P 500 is: +1%No dividends were paid in FebruaryTop 10 Holdings as of 12/31/2016: Citigroup Inc (C): 3.47259%, JPMorgan Chase & Co (JPM): 2.91496%, US Treasury Note 1.75%, Bank of America Corporation (BAC): 2.73851%, US Treasury Note 0.5%, Morgan Stanley (MS): 2.06454%, Citizens Financial Group Inc (CFG): 1.70203%, Apache Corp (APA): 1.65946%, Devon Energy Corp (DVN): 1.5071%, Royal Dutch Shell PLC Class A (OTCPK:RYDAF): 1.39213%|Thu, Mar. 2, 5:20 AM|Bank fine tally since financial crisis

Banks globally have paid $321B in fines since 2008 for an abundance of regulatory failings from money laundering to market manipulation and terrorist financing, according to data compiled by Boston Consulting Group.That tally is set to increase in the coming years as European and Asian regulators catch up with their more aggressive U.S. peers, who have levied the majority of charges to date.Related tickers: JPM, C, BAC, WFC, GS, MS, BCS, LYG, RBS, DB, UBS, HSBC, CS|Thu, Mar. 2, 3:56 AM|AmEx escalates high-fee card competition

Fighting to protect its high-end market, American Express (NYSE:AXP) will begin to offer new perks and benefits on its Platinum charge cards, while upping its annual fee by $100 to $550.Both JPMorgan (NYSE:JPM) and Citigroup (NYSE:C), which has a $450-per-year Prestige card with its own mix of spending credits and perks, are using cards to try to eat away at AmEx profit margins, which have long been higher than their own.|Wed, Mar. 1, 9:27 AM|Banks set for big rally as March rate hike may be on tap

Overnight comments from two influential Fed voices suggested the market was way underpricing the odds of a March rate hike. Not anymore, as rate hike odds have jumped to more than 75% in busy morning trade.Cheering the action the most are the banks. BAC +2.75%, JPM +2.1%, C +2.3%, GS +2.2%, MS +2.5%, USB +1.8%, XLF +1.9%, KBE +1.9%, KRE +2.25% premarket|Tue, Feb. 28, 10:32 AM|Citigroup in talks for Saudi Arabia banking license - Bloomberg

Expecting that the application will be approved, Citigroup (NYSE:C) has been scouting potential staff, according to the report.Saudi Arabia of late has become the center of the investment banking universe thanks to its planned mammoth Saudi Aramco (Private:ARMCO) IPO (though Citi hasn't yet been reported to be involved).|Thu, Feb. 23, 8:55 AM|Citigroup sets up shop in D.C.

The banking giant of course already has plenty of lobbyists in the nation's capital, and this new global regulatory affair team will work alongside. It's to be lead by former longtime OCC official Kevin Bailey.The move brings Citi's (NYSE:C) efforts at shaping regulatory actions closer to the levels of players like Goldman Sachs and JPMorgan. If you don't have a seat at the table, you're the meal.|Tue, Feb. 21, 2:47 PM|Germany likely landing spot for Citi's European investment banking operation

"Germany is among our favorites," says Citigroup's (NYSE:C) CEO for Europe, James Cowles. Specifically, Frankfurt. He takes note of the professionalism of that country's securities regulator (Bafin), and the well-trained Frankfurt workforce.The bank, of course, is making Brexit contingency plans, is set to move several hundred jobs out of London.|Tue, Feb. 21, 11:17 AM|Synchrony Financial expands its CareCredit national acceptance network

 Synchrony Financial (NYSE:SYF) +0.8% signed an agreement with Citibank (NYSE:C), N.A. +0.4% to acquire the Citi Health Card portfolio expanding its healthcare acceptance network in the United States.Citi Health Card portfolio has more than 14,500 providers and 110,000 current consumer accounts.Terms of the agreement were not disclosed.|Thu, Feb. 16, 3:27 PM|Banks move to overhaul money laundering rules - Reuters

The Clearing House - a trade association representing the likes of JPMorgan (NYSE:JPM), Bank of America (NYSE:BAC), and Citigroup (NYSE:C) - for some time has questioned the effectiveness of current rules, but now may find a friendlier reception in D.C.Source: Reuters"Now we tell banks to file a (report) on everything that might be criminal," says the head of a compliance software maker, summing up the problem with the current rules. The number of suspicious activity reports rose to nearly 1M last year vs. 669K in 2013.Compliance with the rules is costing U.S. companies up to $8B per year, according to the Heritage Foundation.The new system to be proposed by The Clearing House envisions banks not investigating and reporting every red flag transaction, but instead looking into specific concerns relayed to them by law enforcement. Lenders in different parts of the country may, for instance, be on the lookout for different sorts of activity.|Wed, Feb. 15, 11:40 AM|Party continues for big banks: BofA leads with 2% gain

There's nothing too new in Janet Yellen's 2nd day on Capital Hill. As with yesterday, she's giving off a more hawkish vibe than at least some may have expected. The 10-year Treasury yield is higher by three basis points to 2.50%, and Fed Funds futures are now pricing in nearly a 50% chance of a March rate hike (up from less than 25% a few days back).The Fed boss is naturally offering a defense of the current regulatory regime, including the Volcker Rule and the CCAR, but the Trump administration, its now-confirmed Treasury Secretary and the leaders of key congressional committees are working to roll back much of Dodd-Frank.XLF (XLF +0.6%), KBE (KBE +0.4%), KRE (KRE +0.2%)Bank of America (BAC +2.2%), Goldman Sachs (GS +0.8%), Citigroup (C +1.2%), Morgan Stanley (MS +1.1%), Wells Fargo (WFC +0.9%), JPMorgan (JPM +0.9%)|Tue, Feb. 14, 11:01 AM|Dollar, banks on the move as Yellen leans hawkish

Testifying before the Senate this morning, Fed Chair Janet Yellen says it would be "unwise" to delay on rate hikes, thus suggesting a move in March could be more likely than previously thought.The 10-year Treasury yield is higher by 6.7 basis points to 2.50%, and Fed Funds futures are pricing in slightly more hawkish Fed policy for the remainder of the year.Also notable was lack of much mention of regulation in Yellen's opening remarks. There had been thought that Yellen would use the opportunity to push back against Trump administration and congressional calls for a sizable rollback of Dodd-Frank and the stress test regime.Welcoming news of higher rates (and no news yet on regulations) is the financial sector: (XLF +0.7%), (KBE +1.2%), (KRE +1.3%)Bank of America (BAC +2%), Wells Fargo (WFC +1%), JPMorgan (JPM +1.2%), Citigroup (C +1.5%), Goldman Sachs (GS +1.2%), Morgan Stanley (MS +2%), Regionsl Financial (RF +1.8%), U.S. Bancorp (USB +0.2%), KeyCorp (KEY +1.5%), PNC Financial (PNC +0.8%), Fifth Third (FITB +1.6%), Lincoln National (LNC +1.7%) MetLife (MET +0.8%), AIG (AIG +0.8%)The dollar (UUP +0.4%) has also moved higher since Yellen took the stage.|Thu, Feb. 9, 2:30 PM|Lenders lead advance as House's Hensarling lays out his plans

Writing in the WSJ last night, the chairman of the House Financial Services Committee called the Consumer Finance Protection Bureau a rogue agency, purposely created to be insulated from Congressional, presidential, or voter oversight."The regulatory web spun by the CFPB can make every provider of financial services guilty until proven innocent, inviting selective enforcement and financial shakedowns."He notes Dodd-Frank specifically excluded auto lenders from CFPB jurisdiction, but that hasn't stopped Richard Cordray (CFPB chief) and company, as the likes of Santander Consumer (SC +1.2%), Ally Financial (ALLY +1%), and Credit Acceptance Corp. (CACC +1.9%) have found out. The House two years ago voted overwhelmingly voted to stop the CFPB's efforts in this area, but Elizabeth Warren was able to halt the bill in the Senate.The president, says Hensarling, should fire Richard Cordray yesterday, put in place a new director to undo all harmful actions taken by the agency, and then get to work putting policies to work that actually protect consumers.Even with better leadership, though, the CFPB would still be unconstitutional, he continues, so the agency must be "functionally terminated" through a simple majority vote to cut off funding (which comes from the Fed, not Congress).In other Hensarling news, Bloomberg has seen a memo outlining other Dodd-Frank reforms, including reducing stress tests to just every other year.XLF +1.3%, KRE +1.5%, KBE +1.3%OneMain (OMF +4.4%), BofA (BAC +1.6%), Citigroup (C +1.7%), Wells Fargo (WFC +1.7%), JPMorgan (JPM +1.3%), Goldman Sachs (GS +1.7%), Morgan Stanley (MS +2.2%), Regions (RF +2.7%), KeyCorp (KEY +1%), SunTrust (STI +1.6%), BB&T (BBT +1.1%), M&T (MTB +1.2%), Zions (ZION +2%)|Thu, Feb. 9, 6:07 AM|Fiduciary rule still in focus

A Dallas federal judge has upheld the Labor Department's fiduciary rule, dealing a setback to the financial industry's attempts to kill the measure.But the legal move may not mean much for the regulation's fate.Last Friday, President Trump issued a memorandum to study the rule's impact and rescind or revise it if it isn't consistent with his administration's regulatory principles. A status report will be published on March 10.Related tickers: JPM, C, BAC, WFC, GS, MS, USB, BK, STT, PNC, COF, KRE, KBE, RF, KEY, IVZ, TROW, LM, AB, FII, WDR, LPLA|Fri, Feb. 3, 10:00 AM|Banks and asset managers higher as Trump takes aim at Dodd-Frank, DOL rule

The president later today is expected to sign executive orders to scale back Dodd-Frank and to postpone implementation of the Department of Labor's fiduciary role."We’re not going to burden the banks with literally hundreds of billions of dollars of regulatory costs every year,” White House National Economic Council Director Gary Cohn tells the WSJ. “The banks are going to be able to price product more efficiently and more effectively to consumers ... This is a table setter for a bunch of stuff that is coming."The moves are sure to upset consumer groups and the opposition party, not to mention the ambitious CFPB and its director Richard Cordray (of whom, Cohn implies his days heading that agency are numbered).KRE +1.45%, KBE +1.6%Bank of America (BAC +2.1%), Citigroup (C +2%), Goldman (GS +3%), Morgan Stanley (MS +3.3%), U.S. Bancorp (USB +1.1%), Regions Financial (RF +1.9%), KeyCorp (KEY +1.5%), PNC (PNC +1.5%), Invesco (IVZ +3.6%), T. Rowe Price (TROW +1.4%), Legg Mason (LM +1.3%), AllianceBernstein (AB +0.8%), Federated (FII +1.4%), Waddell & Reed (WDR +1.8%), LPL Financial (LPLA +1.8%)|Fri, Feb. 3, 6:22 AM|Invesco Equity and Income Fund A (ACEIX) January Summary

January monthly performance was: +0.66%AUM of $14.2B52-week performance vs. the S&P 500 is: -4%No dividends were paid in JanuaryTop 10 Holdings as of 9/30/2016: JPMorgan Chase & Co (JPM): 3.11216%, Citigroup Inc (C): 2.91346%, US Treasury Note 1.125%, US Treasury Note 0.5%, Bank of America Corporation (BAC): 2.04729%, Morgan Stanley (MS): 1.65388%, Apache Corp (APA): 1.61818%, Merck & Co Inc (MRK): 1.45989%, US Treasury Note 0.75%, Devon Energy Corp (DVN): 1.39074%|Fri, Feb. 3, 2:24 AM|Trump to undo Dodd-Frank, fiduciary rule

Removing some of the regulatory burdens on banks, President Trump plans to sign executive actions today seeking a review of the 2010 Dodd-Frank law and a rollback of the so-called fiduciary rule - set to take effect in April.Trump is scheduled to issue the directives at a signing ceremony around noon following a meeting of more than a dozen top corporate executives led by Blackstone (NYSE:BX) CEO Steve Schwarzman.Related tickers: JPM, C, BAC, WFC, GS, MS, USB, BK, STT, PNC, COF|Mon, Jan. 30, 11:40 AM|Banks lead decline on Wall Street

The KBE and KRE are each down more than 2% vs. the S&P 500's 1% retreat.Pick your excuse, but the best explanation is probably seen in the sharp upward and to the right price charts of the banking sector names, and the occasional need to take a breath.There's also politics, and Treasury Secretary nominee Steven Mnuchin over the weekend provided more evidence that the Trump administration intends to tweak, but not gut Dodd-Frank. At issue is the Volcker Rule which prohibits lenders from taking risky bets with federally-insured deposits.Mnuchin in a letter to lawmakers: "A legal distinction between the insured and non-insured entity is an important factor ... I do not believe that the uninsured entity should be able to perform proprietary trading."Bank of America (BAC -2.4%), Citigroup (C -1.7%), JPMorgan (JPM -1.4%), Morgan Stanley (MS -2.1%), U.S. Bancorp (USB -0.9%), Regions Financial (RF -1.5%), KeyCorp (KEY -2.3%), Fifth Third (FITB -2.3%).|Mon, Jan. 30, 7:45 AM|Citigroup getting out of mortgage servicing business

With two deals, Citigroup (NYSE:C) sets its exit from mortgage servicing operations by the end of 2018.The first is an agreement to sell MSRs and related servicing on roughly 780K agency mortgages for non-Citibank retail customers with outstanding loan balances of about $97B to New Residential.The second is the entering of a subservicing agreement with Cenlar FSB for remaining Citi-owned loans and certain MSRs not sold to New Residential.The deals are expected to negatively impact Q1 pretax results by about $400M.CitiMortgage still intends to be in the mortgage origination business.Previously: New Residential cuts another MSR deal, hints at blowout Q4, hikes dividend, sets capital raise (Jan. 30)|Sun, Jan. 29, 9:09 AM|Puerto Rico board extends key deadlines

After selecting Citigroup (NYSE:C) as its financial adviser, Puerto Rico's federal oversight board has voted to give the commonwealth more time to submit a fiscal turnaround plan and restructure $70B in debt without fear of lawsuits.A so-called stay on litigation over missed payments will be moved to May 1 from Feb. 15, while a deadline for a fiscal blueprint will be extended to Feb. 28 from Jan. 31.|Thu, Jan. 26, 9:43 AM|Opportunity for other card companies as CapOne exits Cabela's deal

Cabela's (NYSE:CAB) had a rough session yesterday after Capital One (NYSE:COF) said it doesn't expect regulatory approval for the two's card deal.This could present opportunity for others, says the team at Stephens, which suggests Synchrony Financial (NYSE:SYF), Bank of America (NYSE:BAC), Citigroup (NYSE:C) and TD Bank (NYSE:TD) may have interest in the portfolio.In Synchrony's case, says Stephens, a purchase at a 10% premium to assets would be 5-10% accretive to earnings.For now, Bass Pro is likely to manage the portfolio in-house and put it up for sale yesterday.Source: BloombergPreviously: Capital One down 1.8% following earnings miss (Jan. 24)|Wed, Jan. 25, 5:22 PM|Citigroup declares $0.16 dividend

Citigroup (NYSE:C) declares $0.16/share quarterly dividend, in line with previous.Forward yield 1.11%Payable Feb. 24; for shareholders of record Feb. 6; ex-div Feb. 2.|Wed, Jan. 25, 12:21 PM|Wall Street moves south

Known as "nearshoring," the trend - in which banks move operations away from expensive financial centers like New York to places like Salt Lake City, or North Carolina, or Jacksonville (the focus of this particular article in Bloomberg) - isn't a new one.It's a way to lower costs without heading out of the country - of particular import given the new leadership in D.C. In the case of Jacksonville, high-end corporate office space can be had for about $22 per square foot - roughly 25% of the rate in NYC. Bank employees in Jacksonville earn about 30% less than those in The Big Apple.For workers, the cost of living is appreciably lower, commute times shorter, and a walk on the beach is possible at lunch. They do have to give up things like round-the-clock delivery of any imaginable food, though.Among those with operations in Jacksonville: Deutsche Bank (NYSE:DB), BofA (NYSE:BAC), Citigroup (NYSE:C), JPMorgan (NYSE:JPM), and Wells Fargo (NYSE:WFC).|Tue, Jan. 24, 11:41 AM|Rejection of Aetna/Humana deal could cast pall over M&A - Compass Point

Yesterday's court ruling against the $37B merger of Humana and Aetna alone could cost investment banks more than $100M, according to Compass Point's Charles Peabody, including $41M for Goldman (NYSE:GS), $45M for Citi (NYSE:C), and $15M for Lazard (NYSE:LAZ).Then there's other pending deals like Anthem/Cigna, AT&T/Time Warner, Monsanto/Bayer, and their key advisors like Morgan Stanley (NYSE:MS), Bank of America (NYSE:BAC), and Citi.In addition to what regulators might say, M&A animal spirits may retreat to the sidelines until potential corporate tax changes become clearer.Bottom line: Q1 estimates at the money center banks are assuming improvement in capital markets results, not the lull that might instead be coming (Compass Point is expecting a 15% rise in announced M&A volumes this year to $4.2T).Source: BloombergETFs: KCE|Mon, Jan. 23, 3:37 PM|Breakups may still be on agenda for big banks

After the big rally in the banks since roughly this time last year, the clamor for breaking them up has died down. Return on equity, however, remains historically low, and the chiefs of the Too Big To Fail lenders may again find themselves facing calls to break up or sell off assets, write Lionel Laurent and Gillian Tan at Bloomberg.Citigroup (NYSE:C) makes for an obvious case - its price to tangible book value ratio is less than 1x, a sizable discount to peers (WFC and JPM are approaching 2x, and BAC, MS, GS are all around 1.3x). At least part of that is due to Citi's lower returns and sizable overseas exposure, they write.Should an activist get involved, it could come alongside the appointment of, say, Thomas Hoenig - a supporter of bringing back Glass-Steagall - as vice chair of the Fed (though word is Hoenig has moved to #2 on the depth chart for that spot).|Thu, Jan. 19, 5:42 PM|Citigroup to pay $25M penalty over "spoofing" claims

Citigroup (NYSE:C) agrees to pay a $25M penalty to settle claims by the CFTC that five traders sent Treasury futures orders they  never intended to execute, hoping to artificially boost demand."Spoofing," in which a trader enters large orders as a way to tricking others into believing a fundamental change in the  supply and demand of an asset had occurred, was outlawed by Congress in 2010.The CFTC’s order accused Citi of failing to supervise the traders  but did not make clear if regulators intend to pursue charges against the  individuals.|Wed, Jan. 18, 8:12 AM|Citi latest to top bottom line numbers; market yawns

Q4 net income of $3.6B or $1.14 per share vs. $3.3B and $1.02 earned one year ago. Revenue of $17B fell from $18.5B thanks to the continued wind down of Cit Holdings (which will no longer be reported separately after this quarter); Citicorp revenue rose 6%. Buybacks reduced the float by an average 5%.CET1 ratio of 12.5% up 40 bps for the year. ROE of 6.2% up 30 bps. Tangible book value per share of $64.57 up 7%.Global Consumer Banking revenue of $8B up 2% Y/Y, up 5% in constant dollars.Institutional Clients Group revenue of $8.3B up 11%, with Markets and Securities Services revenue up 24%; fixed income markets revenues of $3B up 36%.Citi Holdings revenues of $657M down 79% Y/Y, with assets down 33% to $54B (now just 3% of Citigroup balance sheet).CC at 11 ETPreviously: Citigroup beats by $0.02, misses on revenue (Jan. 18)C -0.2% premarket|Wed, Jan. 18, 8:00 AM|Citigroup beats by $0.02, misses on revenue

Citigroup (NYSE:C): Q4 EPS of $1.14 beats by $0.02.Revenue of $17.01B (-8.7% Y/Y) misses by $290M.Shares +0.5% PM.Press Release|Tue, Jan. 17, 5:30 PM|Notable earnings before Wednesday’s open

 AMTD, ASML, C, FAST, GS, NTRS, USB|Tue, Jan. 17, 10:01 AM|Morgan Stanley, Comerica lead banks lower despite strong earnings

Bank earnings have been running hot, but having bid the sector sharply higher for nearly all of 2016, and particularly since the election, investors are selling the news.The latest two examples are Morgan Stanley (MS -2.2%) and Comerica (CMA -4.2%), both of which blew past estimates this morning. Comerica, for instance, is up a tidy 85% Y/Y, including a 38% run over the last three months.The KRE is down 2.6% and the KBE down 2.5%.Bank of America (BAC -2.7%), JPMorgan (JPM -2.5%), Citigroup (C -1.8%), Goldman Sachs (GS -1.8%), U.S. Bancorp (USB -2.1%), Regions (RF -3.8%), KeyCorp (KEY -2.8%), PNC Financial (PNC -2.8%), SunTrust (STI -2.6%), Zions (ZION -3.2%).ETFs: XLF, FAS, FAZ, UYG, VFH, IYF, BTO, IYG, FNCL, SEF, FXO, RYF, FINU, RWW, XLFS, FINZ, JHMF, FAZZ, FNCF|Fri, Jan. 13, 10:05 AM|Investors give 'thumbs up' to bank earnings; KBE +2.3%

