C, FHN, INFY, RF, SCHW|Apr. 13, 2016, 11:31 AM|Financials lead markets higher after JPMorgan results


JPMorgan's revenues and profits both fell from a year ago, but the lame performance of the banks thus far this year has already priced in a weak quarter. JPMorgan is higher by 3.8%, with Citigroup (C +4.7%), Bank of America (BAC +3.5%), Wells Fargo (WFC +1.7%), Goldman Sachs (GS +2.9%), and Morgan Stanley (MS +4.4%) joining the party. The XLF is higher by 1.75% vs. the S&P 500's 0.7% advance.
But what about all of these players (except for Citi) having their living wills rejected by the Fed, FDIC, or both? A sideshow, no doubt. Regulators are going to regulate - like the commercial goes, "It's what they do." Banks will tweak plans, numbers, or whatever they need to in order to get D.C. to eventually sign off.
ETFs: XLF, FAS, FAZ, UYG, VFH, IYF, BTO, IAI, IYG, FNCL, SEF, FXO, RYF, KCE, FINU, RWW, XLFS, FINZ, FAZZ

|Apr. 13, 2016, 8:12 AM|D.C. rejects living wills of most major banks


As leaked last night, regulators have sent so-called living wills by five major U.S. banks back to the drawing board. JPMorgan (NYSE:JPM), Wells Fargo (NYSE:WFC), Bank of America (NYSE:BAC), BNY Mellon (NYSE:BK), and State Street (NYSE:STT) have until Oct. 1 to revise their plans or face potential penalties.
Official announcement
Regulators were split on Goldman Sachs (NYSE:GS) and Morgan Stanley (NYSE:MS), with the FDIC giving Goldman a thumbs down, but the Fed not, and just the opposite for Morgan.
Citigroup (NYSE:C) is the only one of the major banks not to have their plan rejected, though both the Fed and FDIC found "shortcomings" that need to be addressed by July 2017.
The next time you're thinking about complaining over some silly fee charged by your lender, have a thought for the armies of accountants, analysts, and lawyers the bank is paying to comply with D.C.'s whims.
ETFs: XLF, FAS, FAZ, UYG, VFH, IYF, BTO, IYG, FNCL, SEF, FXO, RYF, FINU, RWW, XLFS, FINZ, FAZZ

Now read: Financials Are Set To Miss Already Lowered Earnings Estimates

|Apr. 13, 2016, 4:42 AM|WSJ: Regulators to reject 'living wills' of some big banks


At least half of the eight U.S. banks labeled "systemically important" are expected to receive "harsh verdicts" regarding their so-called living wills, sending them scrambling to revise plans about how they would handle a potential bankruptcy, WSJ reports.
The move, which could come as soon as this week, would raise the prospect of higher capital requirements or other regulatory sanctions for some of the institutions, and underscore fears that the firms remain "too big to fail" without a taxpayer bailout.
Related tickers: BK, STT, BAC, JPM, C, GS, MS, WFC

|Apr. 12, 2016, 3:05 PM|Banks will face questions on unfunded loans

“Let’s not sugarcoat it, this is not necessarily a loan a bank wants to make at this point,” says Evercore ISI's Glenn Schorr, talking about loans banks have committed to for energy companies, but upon which those firms have not yet drawn.In Q1, energy borrowers announced draws of more than $3B on these loans, saddling banks with maybe more exposure to the sector than they or their investors would like right now.Citigroup (NYSE:C), for example, has about $20B in funded energy loan exposure, but commitments for nearly another $40B. Bank of America (NYSE:BAC) has loans of just over $20B and commitments for another $20B-plus. Wells Fargo (NYSE:WFC), Morgan Stanley (NYSE:MS), Goldman Sachs (NYSE:GS), SunTrust (NYSE:STI), Comerica (NYSE:CMA), Regions Financial (NYSE:RF), and KeyCorp (NYSE:KEY) are showing similar stories (though mostly smaller amounts). Add it up, and there's $147B of unfunded loans disclosed by the ten of the largest U.S. banks.|Apr. 12, 2016, 7:38 AM|Bloomberg: Citi planning job cuts in London trading operation


Looking to control costs as trading revenue continues to track lower, Citigroup (NYSE:C) is set to let go about 70 traders and salespeople in London this month, reports Bloomberg. The bank could also cut about 200 jobs in operations and technology groups across Europe.
Headcount at Citi was about 231K at year-end, down 30K since CEO Mike Corbat took over in 2012, and down nearly 40% from 2007.
Now read: Citigroup's Energy Loan Problem (April 12)
|Apr. 11, 2016, 11:32 AM|Big bank breakups ... Some, more than others


Focusing on "too big to fail" is too narrow a lens with which to analyze and make decisions about bank size and concentration, says the team at KBW, taking note of increased chatter of late about a forced breakup of the nation's largest lenders.
Returns are part of the mix too, and if they're poor at the mega-banks, this limits credit creation in the economy - a signal, says KBW, that companies must "radically restructure" to get their stock prices above at least tangible book value.
Looking at the stock prices of Wells Fargo (NYSE:WFC), JPMorgan (NYSE:JPM), Bank of America (NYSE:BAC), and Citigroup (NYSE:C) during the past five years, KBW says Wells has traded above TBV throughout the time period - suggesting the bank is consistently creating returns above its cost of capital. Citi, on the other hand, has not traded above TBV for the whole period - "a clear market signal that the company should consider much more radical restructuring to create profitable business that can grow."
|Apr. 8, 2016, 2:45 PM|Banks tweak employment models to retain young talent


According to a LinkedIn analysis done for the WSJ, analysts and associates who exited investment banks in 2015 had stayed an average of 17 months vs. 26 months a decade ago. Going back another ten years, the average tenure was 30 months.
Goldman Sachs (NYSE:GS), JPMorgan (NYSE:JPM), Citigroup (NYSE:C), and Credit Suisse (NYSE:CS) are among the banks altering age-old traditions for young bankers - crazy-long hours of drudgery, slow advancement - to better suit the attitudes of this particular generation of worker bees.
“We’re focused on trying to understand what’s important to the folks we hire right out of school,” says John Waldron, co-head of investment banking at Goldman.
"Every day I can see the direct result of my action," says an ex-employee of Moelis (NYSE:MC), who gave up all-nighters preparing pitch books for the boutique investment bank to instead work for a mobile-gaming startup.
|Apr. 8, 2016, 9:05 AM|Citigroup head of equities sets exit

Coming at a time when flagging fixed-income business has Citi (NYSE:C) and its competitors looking for growth from stock trading, the bank's head of equities Derek Bandeen is retiring, reports the WSJ.Recruited by his former Morgan Stanley colleague Vikram Pandit, Bandeen has been on the job for seven years, but Citi hasn't gained a lot of market share, says the Journal.|Apr. 8, 2016, 4:53 AM|JP Morgan and Citi are Credit Suisse's 2 top big-bank picks


Credit Suisse switches its top big-bank picks, moving JP Morgan (NYSE:JPM) to first spot, and Citigroup (NYSE:C) out of first into second.

JPM: Target $75. Implied upside 28%. "2015 was no easy year; JPM maneuvered through just fine posting above average revenue growth and returns. Results were all the more impressive coupled with targeted and achieved G-SIB surcharge reductions. Sustained share price outperformance relies on continued above average ROE generation."

C: Target $55. Implied upside 32%. "Citi is a value play in U.S. banks sector, trading at 0.7x TBV (vs 1.2x peers; vs Citi’s financial crisis trough of 0.4x – the latter being a unique time; a good bit of regulatory change ought to protect from a return to those scenarios) and has declined 18% YTD (vs -13%) on deteriorating EM and macro backdrop."
Now read Sell The Banks: The Invisible Hand Is Broken »

|Apr. 7, 2016, 3:09 PM|Higher rates? Wait 'till next year


The 10-year Treasury yield at 1.69% has returned back to levels not seen since the panicky action in mid-February. And while the Fed has marked down its expectation of rate hikes this year to just two, short-term interest rate markets haven't even priced in one.
This leaves those whose business model depends on riding the yield curve having to contend with not only a middling macro picture, but - once again - a rates lower for longer picture (although Jamie Dimon says his big fear is that markets aren't pricing in nearly enough in the way of higher rates).
Citigroup (C -4.1%), Bank of America (BAC -3.3%), U.S. Bancorp (USB -2.8%), KeyCorp (KEY -3.4%), Regions Financial (RF -3.4%), BNY Mellon (BK -3.6%), E*Trade (ETFC -4.7%), Manulife (MFC -5.2%), Lincoln National (LNC -3.6%)
|Apr. 7, 2016, 12:44 PM|Big banks: The CCAR submissions are in


"We are confident in the capital strength of the large and mid-cap banks - and with that, their capacity for increased capital returns," says Credit Suisse's Susan Roth Katzke.
Stronger balance sheets, she says, should outweigh what is a harsher adverse scenario from the Fed.
Roth and team see a total net capital return increase of 77% vs. 58% in 2015, with a median payout ratio of 31% vs. 27%. Incremental dollars should be skewed to buybacks given cheap stock valuations and the Fed's preference for the flexibility afforded by repurchases.
Best positioned for the highest capital return are Morgan Stanley (NYSE:MS), Regions Financial (NYSE:RF), Goldman Sachs (NYSE:GS), Fifth Third Bancorp (NASDAQ:FITB), PNC Financial (NYSE:PNC), and U.S. Bancorp (NYSE:USB).
The highest incremental capital returns should come from Zions Bancorp (NASDAQ:ZION), Citigroup (NYSE:C), Bank of America (NYSE:BAC), and M&T Bank (NYSE:MTB).
The lower end of payout ratios should fall on Huntington Bancshares (NASDAQ:HBAN) and Bank of America.
Now read: Sell The Banks: The Invisible Hand Is Broken (April 4)
|Apr. 5, 2016, 10:05 AM|8 stocks with depressed valuations - Goldman


In a research note to clients, Goldman noted that investors typically over-penalize declining profitability. To wit, the S&P 500 currently trades slightly above its 2014 year-end level of 2,059, but its P/B ratio is 4% lower at 2.7x.
Goldman recommends clients consider the following stocks with low P/B ratios:

AIG - P/B of 0.73, implied upside 22%.

BAC - P/B of 0.89, implied upside 26%.

C - P/B of 0.7, implied upside 25%.

CFG - P/B of 0.89, implied upside 24%.

HES - P/B of 0.8, implied upside 29%.

LNC - P/B of 0.92, implied upside 17%.

RF - P/B of 0.96, implied upside 34%.

ZION - P/B of 0.88, implied upside 24%.
Now read Best-Performing Value Strategies: The Price-To-Book Ratio »

|Apr. 4, 2016, 7:28 AM|Invesco Equity and Income Fund A (ACEIX) March Summary

March monthly performance was: +4.86%AUM of $12.5B52-week performance vs. the S&P 500 is: -9%$0.04 in dividends were paid in MarchTop 10 Holdings as of 12/31/2015: JPMorgan Chase & Co (JPM): 3.18%, Citigroup Inc (C): 3.13%, General Electric Co (GE): 2.46%, US Treasury Note 1.625%, Bank of America Corporation (BAC): 1.94%, Morgan Stanley (MS): 1.58%, US Treasury Note 2.25%, Carnival Corp (CCL): 1.3%, PNC Financial Services Group Inc (PNC): 1.26%, Citizens Financial Group Inc (CFG): 1.26%|Apr. 1, 2016, 5:26 PM|Citigroup declares $0.05 dividend


Citigroup (NYSE:C) declares $0.05/share quarterly dividend, in line with previous.
Forward yield 0.47%
Payable May 27; for shareholders of record May 2; ex-div April 28.
|Apr. 1, 2016, 8:14 AM|Citi Holdings assets cut further with reinsurance deal


Fans of the bank will remember Citigroup's (NYSE:C) life insurance operation Primerica which was spun off after the financial crisis. The bank then created Prime Reinsurance to cover a block of term life policies in force on Dec. 18, 2009.
Today's announced deal has Swiss Re (OTCPK:SSREY) replacing Prime Reinsurance as Primerica's reinsurer on a coinsurance agreement. The deal cuts about $2.5B in assets from the balance sheet of Citi Holdings.
Primerica will continue to do business with Prime Re and certain other Citi affiliated reinsurers.
Now read: Bank Of America And Citigroup: Which Is The Better Investment? (Part I: Capital) (March 31)
|Mar. 31, 2016, 12:24 PM|Low expectations could serve big banks well in upcoming earnings season

With everybody expecting continued capital markets weakness and additional energy-related loan loss reserve builds, it may not take much positive news - better than hoped top line growth, efficiency gains, limited credit deterioration - to send bank stocks higher, say Credit Suisse's Susan Katzke and team.There's also the chance of numbers dampening sentiment even further, they say, as perhaps results turn out even worse than the current low expectations.The team continues to favor Bank of America (NYSE:BAC), Citigroup (NYSE:C), JPMorgan (NYSE:JPM), Goldman Sachs (NYSE:GS), and Wells Fargo (NYSE:WFC) among the large caps.Now read: Bank Of America: To Buy Or Not To Buy (March 31)|Mar. 29, 2016, 2:49 PM|Financials continue to await higher rates


Not joining the broad market rally following Janet Yellen's caution on the pace of rate hikes are the financials (XLF -0.2%), where any earnings growth will depend, in part, on higher interest rates.
The S&P 500 is higher by 0.85% and Nasdaq by 1.7%, but Bank of America (BAC -2.2%), Citigroup (C -1%), Wells Fargo (WFC -1.5%), Regions Financial (RF -2.1%), KeyCorp (KEY -1.8%), Fifth Third (FITB -2.1%), MetLife (MET -1.2%), and Prudential (PRU -0.8%) are among those under pressure.
ETFs: XLF, FAS, FAZ, UYG, VFH, IYF, BTO, IYG, SEF, FNCL, FXO, RYF, FINU, RWW, FINZ, XLFS

Previously: Stocks and gold turn higher, yields and dollar lower, on Yellen remarks (March 29)
Previously: Yellen signals caution on rate hikes (March 29)
|Mar. 28, 2016, 11:16 AM|Citi tops AmEx on rewards


The reward terms for Citigroup's (C -0.3%) new Costco (COST +1.3%) card (coming in May and to be named Costco Anywhere) are considerably better than what American Express (AXP -0.7%) offered, including 4% cash back on up to $7K of gasoline purchases per year (AmEx offered 3% on up to $4K).
Citi's Costco card will also give 3% cash back on restaurant purchases vs. 2% from AmEx.
AmEx, of course, could start offering more generous rewards, but they don't come free, and - unlike competitors - AmEx can't make the money back from interest on balances.
Calling Citi's Costco Anywhere card "significantly more appealing" than AmEx's offering, Credit Suisse expects the Citi/Costco partnership to "aggressively pursue increased Costco membership, dominate in-store spending, and generate significant spending outside the store."
|Mar. 24, 2016, 12:07 PM|Bloomberg: Inside look at Wall Street's secret client list

"If you're not inside, you're outside," famously said Gordon Gekko.At the top of a secret list at Citigroup (NYSE:C) is the "Focus Five" - a group of hedge funds that bring in big dollars to the bank: Millennium, Citadel, Surveyor Capital, Point72, and Carlson Capital. These lucrative clients get the best service - top trade ideas, hours-long phone calls with analysts, intimate get-togethers with executives, bespoke trading models, and more.It's part of a new model on Wall Street, with banks backing off the "we-do-everything" model to cater to those select few who generate the most revenue. Players like Morgan Stanley (NYSE:MS) and HSBC are joining Citigroup in focusing on this 1% of the 1%.“It’s a rude awakening when you find out that research isn’t readily available," says Jeff Sica, who manages "only" about $1.5B.Smaller banks too. Stifel Financial (NYSE:SF) has a "Blackjack" list of its top 21 clients, through CEO Ron Kruszewski says it's not currently in use.In today's world, banks have little choice. Hamstrung by the new regulatory environment, barely visible rates, and a lame trading environment, using gates to research to encourage more business is a rare avenue of revenue growth.ETFs: IAI, KCE|Mar. 24, 2016, 10:43 AM|Financials lead market lower


Oil's lower by 2.9% today and about 10% for the week, but it's the financial sector (XLF -1.3%) leading the S&P 500's 0.5% decline today. This even as Jim Bullard becomes the latest Fed speaker to more or less disavow last week's dovish FOMC meeting result, and suggest higher rates could come as soon as April's get-together.
Morgan Stanley (MS -2.9%), Citigroup (C -2.5%), BB&T (BBT -1.3%), U.S. Bancorp (USB -1.3%), MetLife (MET -2.8%), Prudential (PRU -3.5%)
ETFs: XLF, FAS, FAZ, KRE, UYG, VFH, KBE, IYF, BTO, IAT, IYG, SEF, FNCL, FXO, KBWB, QABA, RYF, FINU, KBWR, KRU, RWW, FINZ, KRS, XLFS

|Mar. 22, 2016, 2:42 PM|Bond market thaw as Citigroup and Goldman unload BioMed deal debt


Citigroup (NYSE:C) and Goldman Sachs (NYSE:GS) were able to clear their books of about $1.8B of debt backed by Blackstone's purchase of BioMed Realty Trust. There was strong demand for the offering, inline with what one might expect given the strong rally in risk assets over the past six weeks.
There's also a "flight-to-quality" thanks to Blackstone's track record as a borrower.
Wall Street banks funded a full $14B of real estate buyouts last year - that fast pace combined with the market troubles early this year led to serious congestion on their balance sheets, and the spread between CMBS and Treasurys jumped to nearly three percentage points earlier this year from about one-and-a-half a year ago. That spread has narrowed to 240 basis points since the rally began in mid-February.
|Mar. 22, 2016, 12:33 PM|RBC: Low rates could force breakup of big banks


Return on average common equity (ROACE) is what determines the valuation of large, mature banks, says RBC's Gerard Cassidy, and those banks that cannot earn their cost of equity capital - estimated at 9-10% through the cycle - ought to consider alternative strategies, including breaking up.
The key here is interest rates, and should they remain at these levels for a prolonged period, reaching targeted ROACE will be difficult for all banks, particularly for Bank of America (NYSE:BAC) and Citigroup (NYSE:C).
While a sum-of-the-parts analysis indicates value could be unlocked, the cost of doing so could be prohibitive, says Cassidy.
Long-term investors planning on holding through the cycle are better off with Wells Fargo (NYSE:WFC) and JPMorgan (NYSE:JPM), but active investors managing their portfolios more aggressively might consider BofA and Citi.
|Mar. 21, 2016, 3:44 PM|Citi could face a €706M German tax claim

 Citigroup (NYSE:C) may face a €706M tax claim in Germany due to an audit on upaid taxes from 2007-8. Tax authorities also believe Citi should face additional tax payments for 2009-2011. Citi used a legal loophole to save taxes on dividend-stripping deals by reclaiming capital gains tax on investments several times.Citigroup’s German subsidiary will need support from its parent company; the German unit's capital resources currently amount to €591M.Source: Handlesblatt |Mar. 21, 2016, 1:37 PM|KBW: Citi should break up


"One of the primary benefits of becoming smaller is escaping the vise that is the current regulatory environment,” says the team at KBW, suggesting a three-step process to breaking up the bank: 1) Sell the international consumer business, excluding Mexcio; 2) Sell the Mexico business; 3) Split what's left into a U.S. consumer business and a global corporate bank.
The moves, says KBW, would deliver an estimated market value of $198B, or 57% more than investors currently value Citigroup (C).
"The rules and capital requirements are so high that these banks cannot earn an acceptable return for shareholders, nor can they in some cases earn their cost of capital,” KBW CEO Tom Michaud tells Bloomberg. "The bar has been set too high for these banks to keep their current business models.”
|Mar. 17, 2016, 2:46 AM|JPMorgan, Citi shareholders to vote on potential breakup


Shareholders of JPMorgan (NYSE:JPM) and Citigroup (NYSE:C) will get to vote later this year on one of the most popular questions on the campaign trail: Should the banks break up into smaller pieces?
While the question will be included in the banks' proxy filings, analysts have said it is highly unlikely that shareholders will support the bid.
A similar proposal at Bank of America last year only gained about 4% of the votes.
|Mar. 17, 2016, 2:16 AM|Top 5 U.S. bank CEO pay in 2015:

JPMorgan Chief Executive Jamie Dimon +35% to $27M.Bank of America CEO Brian Moynihan +23% to $16M.Wells Fargo boss John Stumpf unchanged at $19.3M.Citigroup CEO Michael Corbat +27% to $16.5M.U.S. Bancorp head Richard Davis +20% to $21.7M.|Mar. 16, 2016, 2:28 PM|Financials suffer as Fed cuts rate hike forecast


Rallying hard for the last few weeks alongside the markets and hope for a faster pace of rate hikes, the financials (XLF -0.4%) are the worst-performing sector in the minutes after the FOMC's dovish statement and economic/rate projections.
Bank of America (BAC -2.6%), Morgan Stanley (MS -1.9%), Wells Fargo (WFC -0.9%), Citigroup (C -1.4%), Regions (RF -1.7%), PNC (PNC -1.2%), Fifth Third (FITB -1.9%), Schwab (SCHW -2.5%), MetLife (MET -0.4%)
Previously: Stocks, bonds, gold gain, dollar slides, following Fed (March 16)
Previously: Fed bows to markets (March 16)
Previously: Fed stays on hold, sees just two rate hikes this year (March 16)
|Mar. 15, 2016, 8:45 AM|Jefferies posts Q1 loss


"Our overall Q1 results reflect an exceptionally volatile and turbulent market environment during our first fiscal quarter," says Jefferies (NYSE:LUK) CEO Richard Handler. "A quiet December was followed by an extremely challenging January and first few weeks of February."
The investment bank posted a loss of $166.8M in Q1 vs. a profit of $12.9M a year ago. Revenue of $299M fell a full 49%, led by an 82% plunge in trading revenue to $58.8M. Of this, fixed-income revenue fell to $56.8M from $126M. Equity trading revenue fell to just $1.7M from $203.5M thanks to markdowns on two equity block trades.
Good times ahead: Not only have markets stabilized, says management, they've "aggressively snapped back" in the early part of Q2.
Coming one month ahead of the rest of the Wall Street banks, Jefferies results are often seen as a bellwether of what to expect. It sounds like Goldman (NYSE:GS), Morgan Stanley (NYSE:MS), Bank of America (NYSE:BAC), CItigroup (NYSE:C), and JPMorgan (NYSE:JPM) have the month of March to make up for what was a very lame start to the quarter.
ETFs: IAI, KCE, KBWC

|Mar. 14, 2016, 3:19 PM|20 roughed-up financials for catch-up trade


The financial sector (NYSEARCA:XLF) has performed woefully this year, and the banks (NYSEARCA:KBE) even worse. Cornerstone Macro technician Carter Worth finds twenty names trading well beneath their (falling) 150-day moving averages.
The group has shown signs of life lately, and Worth thinks the stocks could move back to their 150-day averages, as stocks in other market sectors have done.
It's strictly a trade, says Worth, who continues to rate the financials as Underweight. The 20:
Ameriprise (NYSE:AMP), BofA (NYSE:BAC), Banner (NASDAQ:BANR), Citigroup (NYSE:C), Citizens Financial (NYSE:CFG), East West Bancorp (NASDAQ:EWBC), First NBC (NASDAQ:FNBC), HFF (NYSE:HF), KeyCorp (NYSE:KEY), Legacy Texas (NASDAQ:LTXB), Lincoln National (NYSE:LNC), Morgan Stanley (NYSE:MS), Old National (NASDAQ:ONB), PacWest (NASDAQ:PACW), PNC Financial (NYSE:PNC), Principal Financial (NYSE:PFG), Stifel Financial (NYSE:SF), SVB Financial (NASDAQ:SIVB), TCF Financial (NYSE:TCB), Wells Fargo (NYSE:WFC).
|Mar. 11, 2016, 5:54 PM|SS&C closes $321M purchase of Citi alternative-fund business

 SS&C (NASDAQ:SSNC) has wrapped an acquisition of Citigroup's (C +3.9%) Alternative Investor Services Business, which performs fund administration for hedge funds and private equity. Citi receives $321M from SS&C in the deal, which creates the industry's No. 2 alternative fund administrator. SS&C will take on more than 1,400 staff, 265 customers and about $395B in assets under administration. Current leaders will stay on and operate as a business unit in SS&C GlobeOp. A conference call to discuss the deal is set for Monday at 9 a.m. ET. |Mar. 11, 2016, 12:49 PM|Bloomberg: Wall Street wants a piece of BlackRock


While the big Wall Street banks are struggling with slides in fixed-income revenues, business is booming at BlackRock (NYSE:BLK) and other ETF providers offering credit-related products.
The banks, writes Lisa Abramowicz, want some of that business back.
The issue for banks are new regulatory and capital rules which make it harder to hold big inventories are paper investors want to trade. Meanwhile, the ease of moving in and out of vehicles like BlackRock's $25B IG bond fund (NYSEARCA:LQD) or its $16B junk-bond fund (NYSEARCA:HYG) have led to surging volumes, even as the individual securities underlying those ETFs are more difficult to trade.
Banks are responding with the total-return swap in which an investor pays a fee to a counterparty who promises delivery of the total gain on a basket of certain debt. These instruments are not only quickly traded without having to deal with the underlying securities, but are pegged to some of the same indexes as the biggest credit ETFs. Citigroup (NYSE:C) just became the eight dealer in these derivatives (joining GS, BAC, JPM, MS, CS, DB and OTCQX:BNPQY), which are being pitched by banks as an alternative to ETFs.
|Mar. 10, 2016, 7:28 AM|Reuters: Citi creates new group to serve fund clients


Looking to boost its business with private-equity firms, hedge funds, sovereign wealth funds, and the like - Citigroup (NYSE:C) creates a new Global Asset Management Group to be led by senior investment bankers Zubaid Ahmad and Brad Coleman.
Ahmad is currently vice chairman of the bank's institutional clients group, and Coleman global head of Citi's alternative assets group - both will hold onto these responsibilities.
Coverage for these types of asset managers has typically been spread across the bank, and it's hoped the new centralized group will grow the business.
